{"capability_profile":"postgresql-base-table-only-representation-v1","collection_plan_sha256":"09a7b970c33ab3ea8480daa350b15bc90326f5d32fc20f358eb4e54c25c657da","kind":"postgresql-table-collection-export","limits":{"max_output_bytes":1000,"max_representation_bytes":1048576,"max_rows":10,"statement_timeout_ms":1000,"wall_timeout_ms":2000},"observed":{"bytes":36,"complete":true,"elapsed_ms":10,"representation_bytes":4617,"rows":2},"postgres_collection_receipt_version":2,"representation_sha256":"12c07bf5c628a1db38d1463ff88825e01081553540110a86ea339dcc5b3ebb4a","source":{"database":"database-a","role":"reader","server_version_num":160015,"source_id":"source-a"},"table_manifests":{"order_lines":"75c276c636f3d4f532a5b99207b9b5b70995d83907dee9cd586355981f5acf8c","orders":"2f73c0e710d140f744005621072561eba7c0a33fb476aa2a4c4de4de38699d9f"},"transaction":{"isolation":"repeatable read","read_only":true,"row_security":"off","snapshot":"1:2:"}}
