{"capability_profile":"postgresql-base-table-only-representation-v1","collection_plan_sha256":"09a7b970c33ab3ea8480daa350b15bc90326f5d32fc20f358eb4e54c25c657da","kind":"postgresql-table-collection-export","limits":{"max_output_bytes":1000,"max_representation_bytes":1048576,"max_rows":10,"statement_timeout_ms":1000,"wall_timeout_ms":2000},"observed":{"bytes":36,"complete":true,"elapsed_ms":10,"representation_bytes":4719,"rows":2},"postgres_collection_receipt_version":2,"representation_sha256":"9fed67364bfc16be298459b9cd90cdf9685463b335d5948a9ad7942e5d8e5cae","source":{"database":"database-a","role":"reader","server_version_num":180006,"source_id":"source-a"},"table_manifests":{"order_lines":"aa007b7ac97aaf6629eda0956b6528ff3fc522b963a4d33b7fc47ee69b0462c8","orders":"5a96db202badfc0046a1b358ab1bfe1ead467fe4833421157799f21ea5548597"},"transaction":{"isolation":"repeatable read","read_only":true,"row_security":"off","snapshot":"1:2:"}}
